{
  "schemaVersion": 3,
  "component": {
    "exportName": "Button",
    "exportType": "named",
    "filePath": "src/components/ui/button.tsx"
  },
  "figma": {
    "componentPath": "Button",
    "lastKnownFileKey": "abc",
    "lastKnownNodeId": "1:2"
  },
  "codePropsMap": {
    "size": { "type": "enum", "values": ["sm", "md"] }
  },
  "figmaBindings": [
    {
      "path": "Button > btn > Size",
      "componentPath": "Button",
      "groupName": "btn",
      "propName": "Size",
      "figmaNodeId": "1:2",
      "figmaType": "VARIANT",
      "mappingKind": "direct",
      "prop": "size",
      "valueMap": { "Small": "sm", "Regular": "md" }
    }
  ]
}
